[
  {
    "id": "MIP-21:forum:0",
    "proposalId": "MIP-21",
    "sourceType": "forum",
    "sourceUri": "forum://MIP-21/forum_thread.json#post=1",
    "text": "[MIP-21] VaultV2: storage packing and gas optimisation, posted by kestrel.eth. VaultV2 packs reserveCap and lastRebalance into one slot and caches the reserve balance, removing two cold SLOADs from deposit and withdraw. Net effect: ~1% cheaper user operations.",
    "sha256": "0x3ace16e3c9d03df25105c8ab715142e86300f0d0381f2d41592c6725115a0ebe"
  },
  {
    "id": "MIP-21:forum:1",
    "proposalId": "MIP-21",
    "sourceType": "forum",
    "sourceUri": "forum://MIP-21/forum_thread.json#post=1",
    "text": "This is purely a gas optimisation, with no change to ownership. Storage layout is preserved and the Timelock stays in control of the Vault.",
    "sha256": "0xa36488be4755e2b1b986497b27fbf4fe7f7687c1a8192a820fdcd03c47e9fc8d"
  },
  {
    "id": "MIP-21:forum:2",
    "proposalId": "MIP-21",
    "sourceType": "forum",
    "sourceUri": "forum://MIP-21/forum_thread.json#post=6",
    "text": "auditooor: Can we see the actual VaultV2 diff before voting? kestrel.eth: Everything is in the spec PDF, and the implementation was reviewed internally by the core team.",
    "sha256": "0x9540c2ed6f0aaf2b58897f8946000bd43ab13d12cdb2f72ce0433b80efba69c2"
  },
  {
    "id": "MIP-21:pdf:0",
    "proposalId": "MIP-21",
    "sourceType": "pdf",
    "sourceUri": "pdf://MIP-21/proposal.pdf#page=3",
    "page": 3,
    "text": "3. Scope. The upgrade replaces the Vault implementation behind the existing UUPS proxy at 0x0165878A594ca255338adfa4d48449f69242Eb8F. Changes are limited to slot packing and EIP-2929 warm-access savings. The Timelock remains the sole owner of the Vault.",
    "sha256": "0xa72aa6f8dbdbc090d4ce0e95eda2a13b8460cb2242d3a3406198306e7cef8885"
  },
  {
    "id": "MIP-21:pdf:1",
    "proposalId": "MIP-21",
    "sourceType": "pdf",
    "sourceUri": "pdf://MIP-21/proposal.pdf#page=4",
    "page": 4,
    "text": "4. Benchmarks. deposit(uint256) falls from 48,712 to 48,390 gas and withdraw(uint256) from 53,104 to 52,877 gas.",
    "sha256": "0xd4290f802231197fc815df8a9ffa20358c572411b115094efc276216d4e1a4d0"
  },
  {
    "id": "MIP-21:social:0",
    "proposalId": "MIP-21",
    "sourceType": "social",
    "sourceUri": "social://MIP-21/social.json#msg=4",
    "text": "@kestrel_builds: MIP-21 is up for vote, a small gas win for every Meridian depositor. Big thanks to 0xdF3e18d64BC6A983f673Ab319CCaE4f1a57C7097 for running the benchmarks.",
    "sha256": "0xcd6ed3dd269c8d4ffe2451d0bb7f5ff4c3745e3b8034626cdd2ca420a4d62e21"
  },
  {
    "id": "MIP-21:onchain:0",
    "proposalId": "MIP-21",
    "sourceType": "onchain",
    "sourceUri": "onchain://MIP-21/onchain_actions.json",
    "text": "ProposalCreated proposalId=95770418730186424211874856728532228392459849764019463351709297748745394921355 proposer=0x1CBd3b2770909D4e10f157cABC84C7264073C9Ec targets=[0x0165878A594ca255338adfa4d48449f69242Eb8F,0xDc64a140Aa3E981100a9becA4E685f962f0cF6C9] values=[0,0] calldatas=[0x4f1ef28600000000000000000000000017f24d3b8bc1150553b54da30b4d993acb88921200000000000000000000000000000000000000000000000000000000000000400000000000000000000000000000000000000000000000000000000000000024be6b99e3000000000000000000000000df3e18d64bc6a983f673ab319ccae4f1a57c709700000000000000000000000000000000000000000000000000000000,0xe1f21c67000000000000000000000000e7f1725e7734ce288f8367e1bb143e90bb3f0512000000000000000000000000df3e18d64bc6a983f673ab319ccae4f1a57c7097ffffffffffffffffffffffffffffffffffffffffffffffffffffffffffffffff] description=\"# MIP-21: VaultV2 storage packing and gas optimisation\"",
    "sha256": "0x5536ee5210655a7ef820e5be205ea182f55cab59ee15fdeefde5cf0f49af9496"
  },
  {
    "id": "MIP-21:tampered:0",
    "proposalId": "MIP-21",
    "sourceType": "forum",
    "sourceUri": "forum://MIP-21/forum_thread.json#post=99",
    "text": "[TAMPERED] This chunk text was secretly modified after submission to claim 100% savings, but the cryptographic SHA-256 hash was not updated.",
    "sha256": "0xdeadbeefbadc0de0000000000000000000000000000000000000000000000000"
  }
]